Store Name,Address,Location,Timings,Latitude,Longitude,Phone
"<a class=""StoreCard_storeAddress__PfC_v null"" href="""" style=""margin-bottom:5px"">20-20-103, Plot No103, Madhuvan Towers, Krishnarajapuram, Near Spencers, Vizianagaram, Andhra Pradesh, 535002</a>"
"<a class=""StoreCard_storeAddress__PfC_v null"" href="""" style=""margin-bottom:5px"">Shop No 10/4/16/2, Upper Ground Floor, Uplands Road, Asilmetta Junction, Ramnagar, Beside Hotel Meghalaya, Visakhapatnam, Andhra Pradesh, 530003</a>"
"<a class=""StoreCard_storeAddress__PfC_v null"" href="""" style=""margin-bottom:5px"">20-1-34, Subash Road, Opposite Super Bazar, Kakinada, Andhra Pradesh, 533001</a>"
"<a class=""StoreCard_storeAddress__PfC_v null"" href="""" style=""margin-bottom:5px"">24B-1-46/1, Vijaya Vihar Centre, Vijaya Vihar Centre, Opposite Gv Mall, Eluru, Andhra Pradesh, 534002</a>"
"<a class=""StoreCard_storeAddress__PfC_v null"" href="""" style=""margin-bottom:5px"">Shop No 23/7/131, Shanthi Nagar, Mr Palli Circle, Tirupati, Andhra Pradesh, 517502</a>"
"<a class=""StoreCard_storeAddress__PfC_v null"" href="""" style=""margin-bottom:5px"">Ground Floor, Mother Teresa Plaza, D No 12-455/20, NH 16 Service Road, Beside Ramachandra Furniture, Tadepalle, Kunchanapalli, Vijayawada, Andhra Pradesh, 522501</a>"
"<a class=""StoreCard_storeAddress__PfC_v null"" href="""" style=""margin-bottom:5px"">10-1-128/7, 60 Feet Wide Road, Mehar Nagar, Gajuwaka, Visakhapatnam, Andhra Pradesh, 530026</a>"
"<a class=""StoreCard_storeAddress__PfC_v null"" href="""" style=""margin-bottom:5px"">45029, Brodipet, Brodipet, Opposite Vajram Hotel, Guntur, Andhra Pradesh, 522002</a>"
"<a class=""StoreCard_storeAddress__PfC_v null"" href="""" style=""margin-bottom:5px"">D No 87/1133, Nandyal Road, Sree Rajeswari Nagar, Sree Rajeswari Nagar, Kurnool, Andhra Pradesh, 518002</a>"
"<a class=""StoreCard_storeAddress__PfC_v null"" href="""" style=""margin-bottom:5px"">21-3-7, Bagath Singh Road, Govt Press, Mutyalampadu Vijayawada, Satyanarayanapuram, Andhra Pradesh, 520011</a>"
"<a class=""StoreCard_storeAddress__PfC_v null"" href="""" style=""margin-bottom:5px"">Ground Floor, 9-45/2,3, Narasimha Nagar, Beside Pizza Hut, Gopalapatnam, Revenue Ward 68, Visakhapatnam, Andhra Pradesh, 530027</a>"
"<a class=""StoreCard_storeAddress__PfC_v null"" href="""" style=""margin-bottom:5px"">59A-20-2, Survey No 134/6, Extent 443.33, South Plot No 29, East Plot No 23 West, Plot No 21, Guru Nanak Colony, Vijayawada, Andhra Pradesh, 520007</a>"
"<a class=""StoreCard_storeAddress__PfC_v null"" href="""" style=""margin-bottom:5px"">H No 27-1-86, Satya, Estates, Muddha Subaiah Street, Lenin Center, Governpet, Elur Road, Patamata, Near Ntr Circle, Vijayawada, Andhra Pradesh, 520010</a>"
"<a class=""StoreCard_storeAddress__PfC_v null"" href="""" style=""margin-bottom:5px"">Ground Floor, Old Badari Shop, Bose Road, Tenali, Andhra Pradesh, 522201</a>"
"<a class=""StoreCard_storeAddress__PfC_v null"" href="""" style=""margin-bottom:5px"">Door No 18/1/635, Ground Floor Bhavani Nagar, V V Mahal Road, Near Municipal Office, Tirupati, Andhra Pradesh, 517501</a>"
"<a class=""StoreCard_storeAddress__PfC_v null"" href="""" style=""margin-bottom:5px"">Shop No 40/1/50, Gvr Complex, Chandramouli Puram, Mg Road, Opposite M&amp;M, Vijayawada, Andhra Pradesh, 520010</a>"
"<a class=""StoreCard_storeAddress__PfC_v null"" href="""" style=""margin-bottom:5px"">D No 58/1/373, Ground Floor, Main Road, Butchirajupalem Nad Junction, Near St. Thomas Church, Visakhapatnam, Andhra Pradesh, 530027</a>"
"<a class=""StoreCard_storeAddress__PfC_v null"" href="""" style=""margin-bottom:5px"">DNo 143, Revenue Ward 9, Municipal Ward No 23, 262, Assesment No 23029 A, Gunadala Krishana, Seetaraampuram, Elur Road, Vijayawada, Andhra Pradesh, 520002</a>"
"<a class=""StoreCard_storeAddress__PfC_v null"" href="""" style=""margin-bottom:5px"">Shop No 40/581/A, Sv Complex, Rs Road, Prakash Nagar, Opposite Tj Shopping Mall, Kurnool, Andhra Pradesh, 518004</a>"
"<a class=""StoreCard_storeAddress__PfC_v null"" href="""" style=""margin-bottom:5px"">Shop No 2G, Srihari Soudha Building, DNo 79/2/4/4, Tilak Road, Opposite Karur Vysya Bank, Rajahmundry, Andhra Pradesh, 533103</a>"
"<a class=""StoreCard_storeAddress__PfC_v null"" href="""" style=""margin-bottom:5px"">Shop No 17/288/1, Ground Floor, Keerthy Towers, Grand Trunk Road, VRC Centre, Nellore, Andhra Pradesh, 524001</a>"
"<a class=""StoreCard_storeAddress__PfC_v null"" href="""" style=""margin-bottom:5px"">50-111-1, Seethammadhara Road, Tpt Colony, Balayya Sastri Layout, Seethammadara, Visakhapatnam, Andhra Pradesh, 530013</a>"
"<a class=""StoreCard_storeAddress__PfC_v null"" href="""" style=""margin-bottom:5px"">No 12/25/46/A, Revenue Ward 27, Assessment No, 76262, 76263, Ground Floor, Kothapet Main Road, Kothapet, Opposite Sudarshan Eye Hospital, Guntur, Andhra Pradesh, 522001</a>"
"<a class=""StoreCard_storeAddress__PfC_v null"" href="""" style=""margin-bottom:5px"">4-55,56, Modem Towers, Patel Road, Annamayya, Madanapalle, Andhra Pradesh, 517325</a>"
"<a class=""StoreCard_storeAddress__PfC_v null"" href="""" style=""margin-bottom:5px"">D No 26-2, Survey No 1940, Plot No 55, Chaitanyapuri, Vedayapalem, Revenue Ward No 26 II, Nellore, Andhra Pradesh, 524004</a>"
"<a class=""StoreCard_storeAddress__PfC_v null"" href="""" style=""margin-bottom:5px"">H No 52-1/1-1B, Ground Floor, Veternory Colony, NH 5 Service Road, Revenue Ward 2, Mahanadu Road, Vijayawada, Andhra Pradesh, 520008</a>"
"<a class=""StoreCard_storeAddress__PfC_v null"" href="""" style=""margin-bottom:5px"">Dno 5-417, Kurnool Road, Kurnool Road, Opposite Chimakurthy Eye Hospital, Ongole, Andhra Pradesh, 523001</a>"
"<a class=""StoreCard_storeAddress__PfC_v null"" href="""" style=""margin-bottom:5px"">2/30/26/1, Jami Function Hall, Sector 6, Mvp Colony, Near Mg Cancer Hospital, Visakhapatnam, Andhra Pradesh, 530017</a>"
"<a class=""StoreCard_storeAddress__PfC_v null"" href="""" style=""margin-bottom:5px"">H No 8/7 &amp; 8/8, Anand Nilayam, Main Road, Lakshmipuram, Near Ntr Municipal Stadium, Guntur, Andhra Pradesh, 522007</a>"
"<a class=""StoreCard_storeAddress__PfC_v null"" href="""" style=""margin-bottom:5px"">Shop No G1, Door No 30-15-158, City Plaza, Daba Gardens, Opposite Sharma Sports, Visakhapatnam, Andhra Pradesh, 530020</a>"
"<a class=""StoreCard_storeAddress__PfC_v null"" href="""" style=""margin-bottom:5px"">D No 10-15-35, Abm Compound Area, Kavali Bit 2, Shop No G-21 &amp; F-21, Survey Number 1080/3-1, 1080/2, Kavali, Kavali, Andhra Pradesh, 524201</a>"
"<a class=""StoreCard_storeAddress__PfC_v null"" href="""" style=""margin-bottom:5px"">46-7-33, Danavipeta, Danavipeta, Rajahmundry, Andhra Pradesh, 533103</a>"
"<a class=""StoreCard_storeAddress__PfC_v null"" href="""" style=""margin-bottom:5px"">Ground Floor, PP Sri Chaitanya School, Rajiv Park Road, Next To More Super Market, Kadapa, Andhra Pradesh, 516001</a>"
"<a class=""StoreCard_storeAddress__PfC_v null"" href="""" style=""margin-bottom:5px"">No 24-3-186, Grand Truck Road, Dargamitta, Near Kims Hospital, Nellore, Andhra Pradesh, 524003</a>"
"<a class=""StoreCard_storeAddress__PfC_v null"" href="""" style=""margin-bottom:5px"">D.No 10-157, Tankasala Vari Centre, Beside HDFC Bank, Enikepadu Complex, Ramavarapadu, Vijayawada, Andhra Pradesh, 521108</a>"
"<a class=""StoreCard_storeAddress__PfC_v null"" href="""" style=""margin-bottom:5px"">13-3-338 B, Ground Floor, Amar Inn Lodge, Bus Stand Road2, Srinivas Nagar, Anantapur, Andhra Pradesh, 515001</a>"
"<a class=""StoreCard_storeAddress__PfC_v null"" href="""" style=""margin-bottom:5px"">H No 76-8-5/3, Survey No 66/1, Plot No 4, Bhavanipuram, Crombay Road No 1, Bhagatsingh Road, Vijayawada Town, Vijayawada Municipal Corporation, Bhavanipuram, Vijayawada, Andhra Pradesh, 520003</a>"
"<a class=""StoreCard_storeAddress__PfC_v null"" href="""" style=""margin-bottom:5px"">27-1-4, J P Road, West Godavari, Next To Srinivasa Hospital, Bhimavaram, Andhra Pradesh, 534202</a>"
"<a class=""StoreCard_storeAddress__PfC_v null"" href="""" style=""margin-bottom:5px"">Door #8/702, Gandhi Road, Opposite Posinsa Compound, Proddatur, Andhra Pradesh, 516360</a>"
"<a class=""StoreCard_storeAddress__PfC_v null"" href="""" style=""margin-bottom:5px"">Door No 31-27-66, Shop No 3, Ground Floor, Beside Indusind ATM, Kurmanna Palem, Revenue Ward 58, Visakhapatnam, Andhra Pradesh, 530046</a>"
"<a class=""StoreCard_storeAddress__PfC_v null"" href="""" style=""margin-bottom:5px"">Shop No 46,15/29, Ground Floor, Meghana Mall, Dwarka Nagar, High Street, Near Diamond Park, Visakhapatnam, Andhra Pradesh, 530016</a>"
"<a class=""StoreCard_storeAddress__PfC_v null"" href="""" style=""margin-bottom:5px"">No 9-1-224/1, T S No 1036/2, Waltair Ward, Cbm Compound, Maddilapalem, Rama Talkies Road, Visakhapatnam, Andhra Pradesh, 530003</a>"
"<a class=""StoreCard_storeAddress__PfC_v null"" href="""" style=""margin-bottom:5px"">Door No 36-46-69/4, Kancharapalem Main Road, Marripalem, Near Rama Rao Hospital, Visakhapatnam, Andhra Pradesh, 530008</a>"
"<a class=""StoreCard_storeAddress__PfC_v null"" href="""" style=""margin-bottom:5px"">31-1-30, Janda Panja Road, Near Ajantha Hotel, Rajahmundry, Andhra Pradesh, 533101</a>"
"<a class=""StoreCard_storeAddress__PfC_v null"" href="""" style=""margin-bottom:5px"">7-183/1/1, Survey No 145/5, Opposite Reliance Smart Point, Ratnagiri Nagar Greater, Visakhapatnam, Andhra Pradesh, 530051</a>"
"<a class=""StoreCard_storeAddress__PfC_v null"" href="""" style=""margin-bottom:5px"">Door No 4-18-37/1, 7th line, Chandramouli Nagar, Beside Platinum Cinemas, Gujjanagulla, Guntur, Andhra Pradesh, 522007</a>"
"<a class=""StoreCard_storeAddress__PfC_v null"" href="""" style=""margin-bottom:5px"">Ground Floor, Venu Regency, Ram Nagar, Jagdamba, Maddilapalem, Visakhapatnam, Andhra Pradesh, 530003</a>"
"<a class=""StoreCard_storeAddress__PfC_v null"" href="""" style=""margin-bottom:5px"">1-262/1 Poranki Gram Sri Rama Complex, Panchayat, Tadigadapa Centre MG Road, Penamaliri Mandal, Kankipadu Sub Reg Area, Krishna District, Vijayawada, Andhra Pradesh 521137</a>"
"<a class=""StoreCard_storeAddress__PfC_v null"" href="""" style=""margin-bottom:5px"">12-1-22/5, 4 Road, Nehru Chowk, Next To Sbi Main Branch, Anakapalle, Andhra Pradesh, 531001</a>"
"<a class=""StoreCard_storeAddress__PfC_v null"" href="""" style=""margin-bottom:5px"">Shop No 206, Ground Floor, Srmt Mall, Sarpavaram Junction, Lalitha Nagar, Besides Kamal Watch Co, Kakinada, Andhra Pradesh, 533005</a>"
"<a class=""StoreCard_storeAddress__PfC_v null"" href="""" style=""margin-bottom:5px"">Ground Floor D No 1-83-47/1, New Venkojipalem, Revenue Ward 8, Srinivasa Plaza, MVP Double Road, MVP Colony, Visakhapatnam, Andhra Pradesh, 530017</a>"
"<a class=""StoreCard_storeAddress__PfC_v null"" href="""" style=""margin-bottom:5px"">1/54/17, Sri Ramnagar Colony, AAS College Road, Kurnool District, Adoni, Andhra Pradesh, 518301</a>"
"<a class=""StoreCard_storeAddress__PfC_v null"" href="""" style=""margin-bottom:5px"">#27-1-58, Sathya Estate, Muddha Subbaiah Street, Governor Pet, Eluru Road, Near South India Shopping Mall, Vijayawada, Andhra Pradesh, 520002</a>"
"<a class=""StoreCard_storeAddress__PfC_v null"" href="""" style=""margin-bottom:5px"">25-695-10, Ttd Road, Srinivasa Nagar, Opposite V-Mart, Nandyal, Andhra Pradesh, 518501</a>"
"<a class=""StoreCard_storeAddress__PfC_v null"" href="""" style=""margin-bottom:5px"">Andmaan Nicobar</a>"
"<a class=""StoreCard_storeAddress__PfC_v null"" href="""" style=""margin-bottom:5px"">Sector A, Nh 415, Sector A, Near Blackberry Store, Naharlagun, Arunachal Pradesh, 791110</a>"
"<a class=""StoreCard_storeAddress__PfC_v null"" href="""" style=""margin-bottom:5px"">Ground Floor, Dag No 1939, Guwahati Road, Baihata Chariali, Assam, 781381</a>"
"<a class=""StoreCard_storeAddress__PfC_v null"" href="""" style=""margin-bottom:5px"">Royal Arcade, Dr. B Barua Road, Ulubari, Guwahati, Assam, 781007</a>"
"<a class=""StoreCard_storeAddress__PfC_v null"" href="""" style=""margin-bottom:5px"">Ward No 4, J D Road, Near HDFC Bank, Sankar Baruah, Kokrajhar, Assam 783370</a>"
"<a class=""StoreCard_storeAddress__PfC_v null"" href="""" style=""margin-bottom:5px"">Ground Floor, Lokhra Road, Kalapahar, Next To Icici Kalapahar Branch, Guwahati, Assam, 781018</a>"
"<a class=""StoreCard_storeAddress__PfC_v null"" href="""" style=""margin-bottom:5px"">Ground Floor, Gs Road, South Sarania, Lachit Nagar, Ulubari, Near Ulubari Petrol Pump, Guwahati, Assam, 781007</a>"
"<a class=""StoreCard_storeAddress__PfC_v null"" href="""" style=""margin-bottom:5px"">Rishav Plaza, A K Azad Road, Rehabari, Beside Apollo Pharmacy, Guwahati, Assam, 781008</a>"
"<a class=""StoreCard_storeAddress__PfC_v null"" href="""" style=""margin-bottom:5px"">Rangagora Road, Near Ultra Lab, Tinsukia, Assam, 786125</a>"
"<a class=""StoreCard_storeAddress__PfC_v null"" href="""" style=""margin-bottom:5px"">Ground Floor, Asian Palace, GS Road, Ulubari Opposite People Store, Near LIC Office, Guwahati, Assam, 781007</a>"
"<a class=""StoreCard_storeAddress__PfC_v null"" href="""" style=""margin-bottom:5px"">Ground Floor, Mancotta Road, Mancotta Road, Near Thana Charali, Dibrugarh, Assam, 786001</a>"
"<a class=""StoreCard_storeAddress__PfC_v null"" href="""" style=""margin-bottom:5px"">Ground Floor, Near Hdfc Bank Tarajan, At Road, Jorhat, Assam, 785001</a>"
"<a class=""StoreCard_storeAddress__PfC_v null"" href="""" style=""margin-bottom:5px"">Ground Floor, Gnb Road, Silpukhuri, Kamrup Metropolition, Silpukhuri, Near Lakshmi Service Station, Guwahati, Assam, 781003</a>"
"<a class=""StoreCard_storeAddress__PfC_v null"" href="""" style=""margin-bottom:5px"">R G Baruah Road, Spanish Garden, Opposite State Zoo, Spanish Garden, Beside Indian Petrol Pump, Guwahati, Assam, 781003</a>"
"<a class=""StoreCard_storeAddress__PfC_v null"" href="""" style=""margin-bottom:5px"">Ground Floor, Hotel Central Point, Opposite Tezpur Police Station, Tezpur, Assam, 784001</a>"
"<a class=""StoreCard_storeAddress__PfC_v null"" href="""" style=""margin-bottom:5px"">Gate No 1, Maligaon Chariali, Guwahati, Assam, 781011</a>"
"<a class=""StoreCard_storeAddress__PfC_v null"" href="""" style=""margin-bottom:5px"">Ground Floor, Chapaguri Road, Opposite Hotel Jahnabee Regency, North Bongaigaon, Amguri, Bongaigaon, Assam, 783380</a>"
"<a class=""StoreCard_storeAddress__PfC_v null"" href="""" style=""margin-bottom:5px"">Shop No 103, Ground Floor, Central Mall, Christian Basti, G S Road, Guwahati, Assam, 781005</a>"
"<a class=""StoreCard_storeAddress__PfC_v null"" href="""" style=""margin-bottom:5px"">Tripal House, At Road, Marwaripatty, Near Indian Oil Petrol Pump, Nagaon, Assam, 782001</a>"
"<a class=""StoreCard_storeAddress__PfC_v null"" href="""" style=""margin-bottom:5px"">Ground Floor, Girish Mansion, Maniram Dewan Road, Bamunimaidan, Beside Reliance Trends, Guwahati, Assam, 781021</a>"
"<a class=""StoreCard_storeAddress__PfC_v null"" href="""" style=""margin-bottom:5px"">Ground Floor &amp; Upper Floor, Rangia Town, Mouza Panduri , P S Rangia Under Rangia Revenue Circle, District Kamrup, Guwahati, Assam, 781354</a>"
"<a class=""StoreCard_storeAddress__PfC_v null"" href="""" style=""margin-bottom:5px"">Style Bazar Building, Mahidhar Borah Road, Mahidhar Borah Road, Opposite Eidgah, Tezpur, Assam, 784001</a>"
"<a class=""StoreCard_storeAddress__PfC_v null"" href="""" style=""margin-bottom:5px"">N S Avenue, Silchar, Ranghirkhari, Opposite Life Line Hospital, Silchar, Assam, 788005</a>"
"<a class=""StoreCard_storeAddress__PfC_v null"" href="""" style=""margin-bottom:5px"">Ground Floor, Ncs Square Mall, Adabari, P O &amp; P S Bolpur, Adabari, Guwahati, Assam, 781014</a>"
"<a class=""StoreCard_storeAddress__PfC_v null"" href="""" style=""margin-bottom:5px"">16 No Tiniali, Duliajan, Duliajan Oil Town, Dibrugarh, Assam, 786602</a>"
"<a class=""StoreCard_storeAddress__PfC_v null"" href="""" style=""margin-bottom:5px"">Ward No 13, Station Chariali, AT Road, Sivasagar, Assam, 785640</a>"
"<a class=""StoreCard_storeAddress__PfC_v null"" href="""" style=""margin-bottom:5px"">Ground Floor Rouchand Complex, Ward No 8, Barama Road, Opposite DC Office, Nalbari, Assam, 781335</a>"
"<a class=""StoreCard_storeAddress__PfC_v null"" href="""" style=""margin-bottom:5px"">Gar-Ali, Jorhat, Gar-Ali, Opposite Gar Ali Masjid, Jorhat, Assam, 785001</a>"
"<a class=""StoreCard_storeAddress__PfC_v null"" href="""" style=""margin-bottom:5px"">Shop No Ff28, First Floor, City Centre Mall, Christian Basti, Guwahati, Assam, 781005</a>"
"<a class=""StoreCard_storeAddress__PfC_v null"" href="""" style=""margin-bottom:5px"">Ground Floor, House No 13, Uttam Marriage Hall, Hatigaon, Hatigaon, Near Bpcl Petrol Pump, Guwahati, Assam, 781038</a>"
"<a class=""StoreCard_storeAddress__PfC_v null"" href="""" style=""margin-bottom:5px"">Ground Floor, Ld Plaza, Gs Road, Dispur, Opposite Assam Secretariat, Guwahati, Assam, 781006</a>"
"<a class=""StoreCard_storeAddress__PfC_v null"" href="""" style=""margin-bottom:5px"">Ground Floor, Khagaul Road, Anisabad, Opposite Mausam Vibhag, Patna, Bihar, 800002</a>"
"<a class=""StoreCard_storeAddress__PfC_v null"" href="""" style=""margin-bottom:5px"">Gola Road, Mouza Danapur, Near V Mart, Shehzadpur Bank Colony Road, Pargana Phulwari, Thana Danapur Sadar Registry, Patna, Bihar, 801503</a>"
"<a class=""StoreCard_storeAddress__PfC_v null"" href="""" style=""margin-bottom:5px"">Ground Floor, Ashok Rajpath, Near Pmch Gate Number 2, Ashok Rajpath, Opposite Bihar Youth Men'S Institute, Patna, Bihar, 800004</a>"
"<a class=""StoreCard_storeAddress__PfC_v null"" href="""" style=""margin-bottom:5px"">Ground Floor, AAS Hotal, kachari Road, Jamui, Bihar, 811307</a>"
"<a class=""StoreCard_storeAddress__PfC_v null"" href="""" style=""margin-bottom:5px"">Banuchapar, N H 28, Supriya Cinema Road, West Champaran, Near St. Joseph School, Bettiah, Bihar, 845438</a>"
"<a class=""StoreCard_storeAddress__PfC_v null"" href="""" style=""margin-bottom:5px"">Circle 247B, Holding 817A/2, Patliputra Circle, Ward 22B, Kurji Road, Kurji Road, Opposite Rbi Quarter, Patna, Bihar, 800010</a>"
"<a class=""StoreCard_storeAddress__PfC_v null"" href="""" style=""margin-bottom:5px"">Shop No 22, Jagdish Lok Apartment, , West Boring Canal Road, Near Harilal'S Sweets, Patna, Bihar, 800001</a>"
"<a class=""StoreCard_storeAddress__PfC_v null"" href="""" style=""margin-bottom:5px"">Main Road, Mohanpur, Mohanpur, Near Reliance Trends, Samastipur, Bihar, 848101</a>"
"<a class=""StoreCard_storeAddress__PfC_v null"" href="""" style=""margin-bottom:5px"">Ground Floor, Vachaspati Nagar, Opposite Kumhrar Park, Sandalpur, Patna, Bihar, 800004</a>"
"<a class=""StoreCard_storeAddress__PfC_v null"" href="""" style=""margin-bottom:5px"">Shop No 143, Ground Floor, Block C, Mauryalok Complex, Dak Bunglow Road, Near Police Station Kotwali, Patna, Bihar, 800001</a>"
"<a class=""StoreCard_storeAddress__PfC_v null"" href="""" style=""margin-bottom:5px"">Laheriasarai Tower, Vip Road , Laheriasarai, Opposite Petrol Pump, Darbhanga, Bihar, 846001</a>"
"<a class=""StoreCard_storeAddress__PfC_v null"" href="""" style=""margin-bottom:5px"">Sn 4, Moti Mansion Apartment, Road No 2, Pc Colony, Kankarbagh, Opposite Apollo Trauma Centre, Patna, Bihar, 800020</a>"
"<a class=""StoreCard_storeAddress__PfC_v null"" href="""" style=""margin-bottom:5px"">Ground Floor, Khata No 708, Ashiana Digha Road, Near Passport Office , Beside Aditya Vision, Patna, Bihar, 800014</a>"
"<a class=""StoreCard_storeAddress__PfC_v null"" href="""" style=""margin-bottom:5px"">Saguna More, Khagaul Road, Front of Panache Banquet, Patna, Bihar, 801503</a>"
"<a class=""StoreCard_storeAddress__PfC_v null"" href="""" style=""margin-bottom:5px"">House No Gm001/1374, Ward No 22, Gb Road, Near Zila School, Gb Road, In Front Of Mvi Office, Gaya, Bihar, 823001</a>"
"<a class=""StoreCard_storeAddress__PfC_v null"" href="""" style=""margin-bottom:5px"">Ground Floor, Krishn Kutri, Pakri, Katira More Road, Bhojpur, Arrah, Near Aditya Vision, Arrah, Bihar, 802301</a>"
"<a class=""StoreCard_storeAddress__PfC_v null"" href="""" style=""margin-bottom:5px"">Khata No 476, Khesra No 693, Anwapur Chowk, Cinema Road, Hajipur, Bihar, 844101</a>"
"<a class=""StoreCard_storeAddress__PfC_v null"" href="""" style=""margin-bottom:5px"">Hotel Holiday International, Shiv Shakti Enterprises, Rn Shaw Chowk, Opposite Roopbani Cinema, Purnia, Bihar, 854301</a>"
"<a class=""StoreCard_storeAddress__PfC_v null"" href="""" style=""margin-bottom:5px"">Ground Floor, Gopalpur Thana, Near Reliance Trends, Sampatchak, Patna, Bihar, 800007</a>"
"<a class=""StoreCard_storeAddress__PfC_v null"" href="""" style=""margin-bottom:5px"">R K Avenue, Nala Road, Near Durga Mandir, Patna, Bihar, 800004</a>"
"<a class=""StoreCard_storeAddress__PfC_v null"" href="""" style=""margin-bottom:5px"">Shyam Smirti Enclave, Rajeev Nagar, Near V Mart, Patna, Bihar, 800024</a>"
"<a class=""StoreCard_storeAddress__PfC_v null"" href="""" style=""margin-bottom:5px"">Shop No 4, Ground Floor, Rk Estate, Pillar 62, Raja Bazar, Opposite Igims, Patna, Bihar, 800014</a>"
"<a class=""StoreCard_storeAddress__PfC_v null"" href="""" style=""margin-bottom:5px"">Bank Road, Chhatauni, Mega Mall, Rajendra Nagar, Motihari, Chhatauni, In Front Of Rehman Hospital, Champaran, Bihar, 845401</a>"
"<a class=""StoreCard_storeAddress__PfC_v null"" href="""" style=""margin-bottom:5px"">Savita Complex, Mithanpura, Club Road, Ramna, Mithanpura, Opposite Mddm College, Muzaffarpur, Bihar, 842002</a>"
"<a class=""StoreCard_storeAddress__PfC_v null"" href="""" style=""margin-bottom:5px"">Main Road Chowk, Thatheri Bazar, Near Reliance Trends, Buxar, Bihar, 802101</a>"
"<a class=""StoreCard_storeAddress__PfC_v null"" href="""" style=""margin-bottom:5px"">Shop No G5, Anshi Series City Complex, , Khaliphabag Chowk, Near Police Station Kotwali, Bhagalpur, Bihar, 812001</a>"
"<a class=""StoreCard_storeAddress__PfC_v null"" href="""" style=""margin-bottom:5px"">Sumaya Residency, Ground Floor, Shop Bearing Nos G2 And G3, Khagaul Road, Phulwarisharif, Near Mahavir Institute And Research Centre, Patna, Bihar, 801505</a>"
"<a class=""StoreCard_storeAddress__PfC_v null"" href="""" style=""margin-bottom:5px"">Mg Road, Near Bank Of India, Mg Road, Aurangabad, Bihar, 824101</a>"
"<a class=""StoreCard_storeAddress__PfC_v null"" href="""" style=""margin-bottom:5px"">Ground Floor, Opposite Citycart, Golamber, Phulwarisharif, Patna, Bihar, 801505</a>"
"<a class=""StoreCard_storeAddress__PfC_v null"" href="""" style=""margin-bottom:5px"">Ward No 20, Lalbagh, Mirzapur, Near Poonam Cinema, Darbhanga, Bihar, 846004</a>"
"<a class=""StoreCard_storeAddress__PfC_v null"" href="""" style=""margin-bottom:5px"">No 20, Rathana Complex, Sri Ram Nagar, Mudichur Road, Tambaram West, Mudichur, Next To More Supre Market, Chennai, Tamil Nadu, 600045</a>"
"<a class=""StoreCard_storeAddress__PfC_v null"" href="""" style=""margin-bottom:5px"">Door No 125/1, Rose Wood Office, Nungambakkam High Road, Nungambakkam, Opposite Teresa Church, Chennai, Tamil Nadu, 600034</a>"
"<a class=""StoreCard_storeAddress__PfC_v null"" href="""" style=""margin-bottom:5px"">Plot No B95, Old Door 37, New Door 22, First Main Road, Jawahar Nagar, Near Max Showroom, Chennai, Tamil Nadu, 600082</a>"
"<a class=""StoreCard_storeAddress__PfC_v null"" href="""" style=""margin-bottom:5px"">G1, Plot No 3, Vgp Prabhu Nagar, Perumbakkam, Opposite Advent Church, Chennai, Tamil Nadu, 600100</a>"
"<a class=""StoreCard_storeAddress__PfC_v null"" href="""" style=""margin-bottom:5px"">No 1 &amp; 2 Main Road, Venkateswara Nagar, 100Ft Bypass Road, Velachery, Chennai, Tamil Nadu, 600042</a>"
"<a class=""StoreCard_storeAddress__PfC_v null"" href="""" style=""margin-bottom:5px"">No 71, 1, Arcot Road, Vadapalani, Vadapalani, Chennai, Tamil Nadu, 600026</a>"
"<a class=""StoreCard_storeAddress__PfC_v null"" href="""" style=""margin-bottom:5px"">183/16 Gnt Road, Redhills, Near Annamalai Cell City, Chennai, Tamil Nadu, 600052</a>"
"<a class=""StoreCard_storeAddress__PfC_v null"" href="""" style=""margin-bottom:5px"">38/13, 1St Main Road, Macmillan Colony, Nanganallur, Chennai, Tamil Nadu, 600061</a>"
"<a class=""StoreCard_storeAddress__PfC_v null"" href="""" style=""margin-bottom:5px"">No 14, Madhavaram High Road Sembiam, Moolakadai, Perambur Road, Madhavaram, Opposite Simpon Gate No 1, Chennai, Tamil Nadu, 600011</a>"
"<a class=""StoreCard_storeAddress__PfC_v null"" href="""" style=""margin-bottom:5px"">27, Agaram Main Road, Ranganatha Nagar, Selaiyur, Chennai, Tamil Nadu, 600073</a>"
"<a class=""StoreCard_storeAddress__PfC_v null"" href="""" style=""margin-bottom:5px"">New No 08, Old No 6/169 Mgr Main Road, Govindaswamy Nagar 5Th Street, Kandanchavadi, Next To Gem Hospital, Chennai, Tamil Nadu, 600096</a>"
"<a class=""StoreCard_storeAddress__PfC_v null"" href="""" style=""margin-bottom:5px""># 415, Ecr Road, Next To Amet University, Kanathur, Chennai, 603112</a>"
"<a class=""StoreCard_storeAddress__PfC_v null"" href="""" style=""margin-bottom:5px"">Shop No 38 (Old) 60 (New), Ground Floor, Jai Durga Apartment, Ashok Nagar, Chennai, Hot Chips, 1St Avenue, Chennai, Tamil Nadu, 600083</a>"
"<a class=""StoreCard_storeAddress__PfC_v null"" href="""" style=""margin-bottom:5px"">Urapakkam Flyover, Sri Balaji Nagar, Urapakkam, Perungalathur, Urapakkam, Chennai, Tamil Nadu, 603211</a>"
"<a class=""StoreCard_storeAddress__PfC_v null"" href="""" style=""margin-bottom:5px"">Shop No 93, Ssm Complex, Rajakadai, Thiruvottiyur, Opposite Rohit Hospital, Chennai, Tamil Nadu, 600019</a>"
