Store Name,Address,Location,Timings,Latitude,Longitude,Phone"<a class=""StoreCard_storeAddress__PfC_v null"" href="""" style=""margin-bottom:5px"">P T R Complex, No 56, Kalavasal Bypass Road, Kalavasal, Madurai, Tamil Nadu, 625010</a>"
"<a class=""StoreCard_storeAddress__PfC_v null"" href="""" style=""margin-bottom:5px"">No 117, Karamadai Road, Coimbatore Main Road, Near Axis Bank, Mettupalayam, Tamil Nadu, 641301</a>"
"<a class=""StoreCard_storeAddress__PfC_v null"" href="""" style=""margin-bottom:5px"">Pc 2/6, Second Block, Moggapair West, Near Bharat Petroleum Petrol Pump, Chennai, Tamil Nadu, 600037</a>"
"<a class=""StoreCard_storeAddress__PfC_v null"" href="""" style=""margin-bottom:5px"">N0 50, Palanisamy, Road, Opposite Indian Oil Petrol Pump, Tirupattur, Tamil Nadu, 635601</a>"
"<a class=""StoreCard_storeAddress__PfC_v null"" href="""" style=""margin-bottom:5px"">Shop No 29/15, Jayliz Junction, Azad Road, Gandhi Nagar, Aravind Eye Hospital Road, Gandhi Nagar, Near Anna Bus Stand, Madurai, Tamil Nadu, 625020</a>"
"<a class=""StoreCard_storeAddress__PfC_v null"" href="""" style=""margin-bottom:5px"">No 66 &amp; 67, Sivanandha Nagar, 200 Feet Road, Kolathur, Kolathur, Near Sendhil Nagar Bus Stop, Chennai, Tamil Nadu, 600099</a>"
"<a class=""StoreCard_storeAddress__PfC_v null"" href="""" style=""margin-bottom:5px"">Shop No 5/351, Omr Road, Okkiyampettar, Thuraipakkam, Opposite Indian Oil Petrol Pump, Chennai, Tamil Nadu, 600097</a>"
"<a class=""StoreCard_storeAddress__PfC_v null"" href="""" style=""margin-bottom:5px"">TJP Complex, GST Road, Tambaram Sanatorium, Tambaram, Chennai, Tamil Nadu, 600045</a>"
"<a class=""StoreCard_storeAddress__PfC_v null"" href="""" style=""margin-bottom:5px"">Shop No 37/B, Aryagowda Road, Postal Colony, West Mambalam, Opposite West Mambalam Post Office, Chennai, Tamil Nadu, 600033</a>"
"<a class=""StoreCard_storeAddress__PfC_v null"" href="""" style=""margin-bottom:5px"">3 &amp; 4A, Ground Floor, Sri Ramana Complex, Trichy Road, Sulur, Near Rvs College Arts &amp; Science, Coimbatore, Tamil Nadu, 641402</a>"
"<a class=""StoreCard_storeAddress__PfC_v null"" href="""" style=""margin-bottom:5px"">Block 2, 2 63 E, C P Sons Complex, Ammankoil, Marthandam, Kanyakumari, Tamil Nadu, 629165</a>"
"<a class=""StoreCard_storeAddress__PfC_v null"" href="""" style=""margin-bottom:5px"">No 3, Avinashi Road, Gandhi Road Junction, Anupparpalayam, Tiruppur, Tamil Nadu, 641652</a>"
"<a class=""StoreCard_storeAddress__PfC_v null"" href="""" style=""margin-bottom:5px"">No 335 1, 80Ft Road, Anna Nagar, Sathamangalam, Anna Nagar, Near Hdfc Bank, Madurai, Tamil Nadu, 625020</a>"
"<a class=""StoreCard_storeAddress__PfC_v null"" href="""" style=""margin-bottom:5px"">Old No 118, New Door No 16, Bazzar Road, Saidapet, Chennai, Tamil Nadu, 600015</a>"
"<a class=""StoreCard_storeAddress__PfC_v null"" href="""" style=""margin-bottom:5px"">234, Rk Mutt Road, Mylapore, Mylapore, Chennai, Tamil Nadu, 600004</a>"
"<a class=""StoreCard_storeAddress__PfC_v null"" href="""" style=""margin-bottom:5px"">Ts No 5/63, Babuji Complex, Gandhi Road, Parapatti, Sivakasi, Tamil Nadu, 626123</a>"
"<a class=""StoreCard_storeAddress__PfC_v null"" href="""" style=""margin-bottom:5px"">9-C Nethaji Byepass Road, Hotel Agarwal Bavan Building, Next to DDCC Bank, Dharmapuri, Tamil Nadu, 636701</a>"
"<a class=""StoreCard_storeAddress__PfC_v null"" href="""" style=""margin-bottom:5px"">Store No A5, Passport Office Building, Shastri Road, Thillai Nagar, Megastar Cinema, Tiruchirappalli, Tamil Nadu, 620018</a>"
"<a class=""StoreCard_storeAddress__PfC_v null"" href="""" style=""margin-bottom:5px"">Shop No 1, Gds Complex, Green Circle, New Katpadi Road, Katpadi, Opposite New Bus Stand, Vellore, Tamil Nadu, 632004</a>"
"<a class=""StoreCard_storeAddress__PfC_v null"" href="""" style=""margin-bottom:5px"">Shop No 441, Peelamedu, Peelamedu, Opposite Sms Hotel, Coimbatore, Tamil Nadu, 641004</a>"
"<a class=""StoreCard_storeAddress__PfC_v null"" href="""" style=""margin-bottom:5px"">100, Next to Westside Showroom, Kalavasal Junction, Theni Road, Madurai, Tamil Nadu, 625016</a>"
"<a class=""StoreCard_storeAddress__PfC_v null"" href="""" style=""margin-bottom:5px"">#100, Ground Floor, Medavakam Main Road, Keelkattalai, Chennai, Tamil Nadu, 600117</a>"
"<a class=""StoreCard_storeAddress__PfC_v null"" href="""" style=""margin-bottom:5px"">No 22, Kambar Street, Vivekananda Nagar, Mkb Nagar, Kodungaiyur, Opposite Hp Petrol Pump, Chennai, Tamil Nadu, 600118</a>"
"<a class=""StoreCard_storeAddress__PfC_v null"" href="""" style=""margin-bottom:5px"">52, Dr Rajendra Prasad Road, Kumudham Colony, Nehru Nagar, Hastinapuram, Chromepet, Chennai, Tamil Nadu, 600064</a>"
"<a class=""StoreCard_storeAddress__PfC_v null"" href="""" style=""margin-bottom:5px"">Plot B, Survey No 56/1A Ground Floor, Promenade Sh49, Ecr Injambakkam, Opposite Vgp, Chennai, Tamil Nadu, 600115</a>"
"<a class=""StoreCard_storeAddress__PfC_v null"" href="""" style=""margin-bottom:5px"">31/1, Thillai Nagar 1-24, 3Rd Cross, Tiruchirapalli, Tamil Nadu, 620018</a>"
"<a class=""StoreCard_storeAddress__PfC_v null"" href="""" style=""margin-bottom:5px"">Survey No 102, Patta No 74, 104, Kaliamman Koil St, Virugambakkam, Chinmayanagar, Chennai, Tamil Nadu, 600092</a>"
"<a class=""StoreCard_storeAddress__PfC_v null"" href="""" style=""margin-bottom:5px"">Ground Floor No 31, Thirukachi Nambi Street, Near Pachaiyappa's Women College Bus Stop, Kanchipuram, Tamil Nadu, 631501</a>"
"<a class=""StoreCard_storeAddress__PfC_v null"" href="""" style=""margin-bottom:5px"">154/24 A, Nelson Manickam Road, Metha Nagar, Near Shobhan Babu Statue, Chennai, Tamil Nadu, 600029</a>"
"<a class=""StoreCard_storeAddress__PfC_v null"" href="""" style=""margin-bottom:5px"">Ground Floor, Mayanz Forum, Building No 27, Mettupalayam Road, Thudiyalur, Tamil Nadu, 641034</a>"
"<a class=""StoreCard_storeAddress__PfC_v null"" href="""" style=""margin-bottom:5px"">176/1, Chairman Ramalingam Road, Near Soundaraja Perumal Kovil, Ammapet, Salem, Tamil Nadu, 636001</a>"
"<a class=""StoreCard_storeAddress__PfC_v null"" href="""" style=""margin-bottom:5px"">Shop No G18, Ground Floor, Old Sivanandha Mills, Sivanandhapuram, Prozone Mall, Coimbatore, Tamil Nadu, 641035</a>"
"<a class=""StoreCard_storeAddress__PfC_v null"" href="""" style=""margin-bottom:5px"">Sd Groups No 9, Someswarar Sannathi Street, Near Utchipillaiyar Kovil, Kumbakonam, Tamil Nadu, 612001</a>"
"<a class=""StoreCard_storeAddress__PfC_v null"" href="""" style=""margin-bottom:5px"">No 26, Vinayagapuram Street, 1St Main Road, Mmda Colony Arumbakkam, Mmda Colony Arumbakkam, Opposite Apollo Pharmacy, Chennai, Tamil Nadu, 600106</a>"
"<a class=""StoreCard_storeAddress__PfC_v null"" href="""" style=""margin-bottom:5px"">5, Sakthi Nagar Main Road, Adambakkam, Near Nayana Petrol Pump, Chennai, Tamil Nadu, 600088</a>"
"<a class=""StoreCard_storeAddress__PfC_v null"" href="""" style=""margin-bottom:5px"">269, 18Th Main Road, Udhayam Colony, Anna Nagar, 18Th Main Road, Chennai, Tamil Nadu, 600040</a>"
"<a class=""StoreCard_storeAddress__PfC_v null"" href="""" style=""margin-bottom:5px"">Shop No 212, Ground Floor, Gst Road, , Chrompet, Near Chrompet Railway Station, Chennai, Tamil Nadu, 600044</a>"
"<a class=""StoreCard_storeAddress__PfC_v null"" href="""" style=""margin-bottom:5px"">2334 Ondipudur Trichy Road, Ondipudur Bus Stop, Ondipudur, Opposite The Chennai Mobiles, Coimbatore, Tamil Nadu, 641016</a>"
"<a class=""StoreCard_storeAddress__PfC_v null"" href="""" style=""margin-bottom:5px"">358-368, MG Road, Stainte Therese Street Junction, Opposite Petit Seminare School, Puducherry, Tamil Nadu, 605001</a>"
"<a class=""StoreCard_storeAddress__PfC_v null"" href="""" style=""margin-bottom:5px"">SF No 2B1 &amp; A1, Thanjavur Main Road, Ellakudi, Kattur, Tiruchirappalli, Tamil Nadu, 620019</a>"
"<a class=""StoreCard_storeAddress__PfC_v null"" href="""" style=""margin-bottom:5px"">Shop No 12/B, Ground Floor, Kakkan Street, West Tambaram, Next To Vidhya Theatre, Chennai, Tamil Nadu, 600045</a>"
"<a class=""StoreCard_storeAddress__PfC_v null"" href="""" style=""margin-bottom:5px"">New No 24, Old No 42, Kalaignar Nedunchalai, Srinivasanagar, Perungalathur, Chennai, Tamil Nadu, 600063</a>"
"<a class=""StoreCard_storeAddress__PfC_v null"" href="""" style=""margin-bottom:5px"">#63, NGO Nagar Extension, Hariharan Bazaar Street, Opposite Reliance Trends, Ponneri, Thiruvallur, Tamil Nadu, 601204</a>"
"<a class=""StoreCard_storeAddress__PfC_v null"" href="""" style=""margin-bottom:5px"">Shop No Ab152, Flat No 41B, 4Th Avenue, Shanthi Colony, Anna Nagar, Opposite Srivari Sweets, Chennai, Tamil Nadu, 600040</a>"
"<a class=""StoreCard_storeAddress__PfC_v null"" href="""" style=""margin-bottom:5px"">95/1b, Next to Federal Bank, Sathy Road, Saravanampatti, Opposite Guruamuthas Veg Tradition, Coimbatore, Tamil Nadu, 641035</a>"
"<a class=""StoreCard_storeAddress__PfC_v null"" href="""" style=""margin-bottom:5px"">2/220, Kattupakkam Main Road, No 47, Taluk Ponnamallee South, Chennai, Tamil Nadu, 600056</a>"
"<a class=""StoreCard_storeAddress__PfC_v null"" href="""" style=""margin-bottom:5px"">Door No 61 &amp; 62, Shop No 7 &amp; 8, Municipality Ward No 6, Kovai Road, Pollachi, Tamil Nadu, 642002</a>"
"<a class=""StoreCard_storeAddress__PfC_v null"" href="""" style=""margin-bottom:5px"">1267 &amp; 262, Kumaran Road, Tiruppur, Tamil Nadu, 641601</a>"
"<a class=""StoreCard_storeAddress__PfC_v null"" href="""" style=""margin-bottom:5px"">203/360, Triplicane High Road, Triplicane, Opposite To South Indian Bank, Chennai, Tamil Nadu, 600005</a>"
"<a class=""StoreCard_storeAddress__PfC_v null"" href="""" style=""margin-bottom:5px"">No 33 &amp; 56, Old, Vellalar St, Near to Grace Super Market, Paramesh Nagar, Adambakkam, Chennai, Tamil Nadu, 600088</a>"
"<a class=""StoreCard_storeAddress__PfC_v null"" href="""" style=""margin-bottom:5px"">No 396, Palakkad Main Road, Kuniyamuthur, Near Reliance Kannan Smart, Coimbatore, Tamil Nadu, 641008</a>"
"<a class=""StoreCard_storeAddress__PfC_v null"" href="""" style=""margin-bottom:5px"">No 137/8/86, Avinashi Road, Asher Nagar, Opposite Indian Oil Petrol Pump, Tiruppur, Tamil Nadu, 641603</a>"
"<a class=""StoreCard_storeAddress__PfC_v null"" href="""" style=""margin-bottom:5px"">Shop No 1530/7, Old Mahabalipuram Road, Kelambakkam, Near Indian Oil Petrol Pump, Kanchipuram, Tamil Nadu, 603103</a>"
"<a class=""StoreCard_storeAddress__PfC_v null"" href="""" style=""margin-bottom:5px"">29 A, Palani Road, Palani Road, Near Reliace Mart, Dindigul, Tamil Nadu, 624001</a>"
"<a class=""StoreCard_storeAddress__PfC_v null"" href="""" style=""margin-bottom:5px"">New No 214/5, Ground Floor, Kannan Nagar, Polur Main Road, Vengikkal, Near By Anna Arch, Thiruvannamalai, Tamil Nadu, 606604</a>"
"<a class=""StoreCard_storeAddress__PfC_v null"" href="""" style=""margin-bottom:5px"">Shop No 3 &amp; 4, Ground Floor, Plot No 72, Vayalur Road, Next To Bishop College, Trichy, Tamil Nadu, 620017</a>"
"<a class=""StoreCard_storeAddress__PfC_v null"" href="""" style=""margin-bottom:5px"">234, Avinashi Road, Peelamedu, Pkd Nagar, Hopes College, Near Varadharaja Mills Bus Stop, Coimbatore, Tamil Nadu, 641004</a>"
"<a class=""StoreCard_storeAddress__PfC_v null"" href="""" style=""margin-bottom:5px"">G2, Block 1, Amm Towers, No 50, Thiruvalluvar Road, Mogappair East, Near Spartan School, Chennai, Tamil Nadu, 600037</a>"
"<a class=""StoreCard_storeAddress__PfC_v null"" href="""" style=""margin-bottom:5px"">50, Arihant Square, Gf, Mt Poonamalle Raod, Iyyappanthangal, Near Smrc Kfc, Chennai, Tamil Nadu, 600056</a>"
"<a class=""StoreCard_storeAddress__PfC_v null"" href="""" style=""margin-bottom:5px"">Shop No 11, Ground Floor, Nina Building, Covai Road, Ramanujam Nagar, Opposite Amaravathi Hospital, Karur, Tamil Nadu, 639002</a>"
"<a class=""StoreCard_storeAddress__PfC_v null"" href="""" style=""margin-bottom:5px"">Shop No 21A, Second Floor, Survey 13/1A, Egatoor, Marina Mall, Near Lifestyle, Chennai, Tamil Nadu, 603103</a>"
"<a class=""StoreCard_storeAddress__PfC_v null"" href="""" style=""margin-bottom:5px"">No 526, Periyakulam Road, Periyakulam, Near Little Kingdom School, Theni, Tamil Nadu, 625531</a>"
"<a class=""StoreCard_storeAddress__PfC_v null"" href="""" style=""margin-bottom:5px"">No 157/17E, J N Road, Thiruvallur, Next To Dragarwals Eye Hospital, Thiruvallur, Tamil Nadu, 602001</a>"
"<a class=""StoreCard_storeAddress__PfC_v null"" href="""" style=""margin-bottom:5px"">18/1, Sundar Nagar, K K Nagar, K K Nagar, Tiruchirappalli, Tamil Nadu, 620021</a>"
"<a class=""StoreCard_storeAddress__PfC_v null"" href="""" style=""margin-bottom:5px"">#109E, Trivandrum, Palayamkottai, Opposite Voc Ground, Tirunelveli, Tamil Nadu, 627002</a>"
"<a class=""StoreCard_storeAddress__PfC_v null"" href="""" style=""margin-bottom:5px"">Plot#1, Bhuvaneswari Nagar, Velacherri Main Road, Gowrivakkam, Next To Saibaba Temple Lane, Chennai, Tamil Nadu, 600073</a>"
"<a class=""StoreCard_storeAddress__PfC_v null"" href="""" style=""margin-bottom:5px"">383, Konnur High Road, United India Nagar, Ayanavaram, Chennai, Tamil Nadu, 600023</a>"
"<a class=""StoreCard_storeAddress__PfC_v null"" href="""" style=""margin-bottom:5px""># 09, Thulukka Street, Kundrathur, Opposite City Union Bank, Chennai, Tamil Nadu, 600069</a>"
"<a class=""StoreCard_storeAddress__PfC_v null"" href="""" style=""margin-bottom:5px"">91, Poonamallee High Road, Nerkundram, Near City Union Bank, Chennai, Tamil Nadu, 600107</a>"
"<a class=""StoreCard_storeAddress__PfC_v null"" href="""" style=""margin-bottom:5px"">No98A, Lehro Arcade, Azhagar Kovil Road, Goripalayam, Madurai, Tamil Nadu, 625002</a>"
"<a class=""StoreCard_storeAddress__PfC_v null"" href="""" style=""margin-bottom:5px"">Shop No 130/A, Cape Road, Opposite St Joseph Convent School, Nagercoil, Tamil Nadu, 629002</a>"
"<a class=""StoreCard_storeAddress__PfC_v null"" href="""" style=""margin-bottom:5px"">No 69, VG2, Natwest Vijay, Vagai Blk, Velachery Road, Pallikaranai, Chennai, Tamil Nadu, 600100</a>"
"<a class=""StoreCard_storeAddress__PfC_v null"" href="""" style=""margin-bottom:5px"">4/970, Kayalvizhi Commercial Complex, Erode Main Road karattur, Gobichettipalayam, Tamil Nadu, 638476</a>"
"<a class=""StoreCard_storeAddress__PfC_v null"" href="""" style=""margin-bottom:5px"">No 89/2, Gandhi Road, Beside Vasanth &amp; Co, Arakkonam, Tamil Nadu, 631001</a>"
"<a class=""StoreCard_storeAddress__PfC_v null"" href="""" style=""margin-bottom:5px"">No 1/357, Mullai Nagar, Pn Pudur, Vadavalli, Opposite Vallalar Hospital, Coimbatore, Tamil Nadu, 641041</a>"
"<a class=""StoreCard_storeAddress__PfC_v null"" href="""" style=""margin-bottom:5px"">No 85, Mettupalayam Road, Saibaba Kovil, Mettupalayam, Opposite Ganga Hospital &amp; Saibaba Police Station, Coimbatore, Tamil Nadu, 641011</a>"
"<a class=""StoreCard_storeAddress__PfC_v null"" href="""" style=""margin-bottom:5px"">Ground Floor, No 37, Seelanaickenpatti Bypass, Mayura Complex, Seelanaickenpatti, Salem,Tamil Nadu, 636201</a>"
"<a class=""StoreCard_storeAddress__PfC_v null"" href="""" style=""margin-bottom:5px"">#354, Ve Road, Near Indian Terrian, Thoothukudi, Tamil Nadu, 628002</a>"
"<a class=""StoreCard_storeAddress__PfC_v null"" href="""" style=""margin-bottom:5px"">268, West Masi Street, Near Old Arya Bhavan Junction, Madurai Main, Madurai, Tamil Nadu, 625001</a>"
"<a class=""StoreCard_storeAddress__PfC_v null"" href="""" style=""margin-bottom:5px"">102/21 , Methu Street, Villivakkam, Opposite Bharat Petrol Pump, Chennai, Tamil Nadu, 600049</a>"
"<a class=""StoreCard_storeAddress__PfC_v null"" href="""" style=""margin-bottom:5px"">#689, Cth Road, Avadi, Avadi, Next To Poorvika, Chennai, Tamil Nadu, 600054</a>"
"<a class=""StoreCard_storeAddress__PfC_v null"" href="""" style=""margin-bottom:5px"">No 128 , Redhills Main Road, Palaniyappa Nagar, Pudur, Ambattur, Opposite Emmanuel Methodist Matriculation Higher Secondary School, Chennai, Tamil Nadu, 600053</a>"
"<a class=""StoreCard_storeAddress__PfC_v null"" href="""" style=""margin-bottom:5px"">Plot#139, Vgp Vimala Nagar, Medavakkam, Chennai, Tamil Nadu, 600100</a>"
"<a class=""StoreCard_storeAddress__PfC_v null"" href="""" style=""margin-bottom:5px"">Ground Floor, No 3942, Ward No 28, Keezha Raja Veethi, Puddukottai, Tamil Nadu, 622001</a>"
"<a class=""StoreCard_storeAddress__PfC_v null"" href="""" style=""margin-bottom:5px"">No 578/A,578/2, Village Ambattur, Ayyapakkam Road, Ambattur Taluk, Tiruvallur District, Next To Nayara Petrol Bunk, Chennai, Tamil Nadu, 600077</a>"
"<a class=""StoreCard_storeAddress__PfC_v null"" href="""" style=""margin-bottom:5px"">Shop No 43A/77, Ground Floor, Gandhi Road, Kanchipuram, Opposite Punjab National Bank, Kanchipuram, Tamil Nadu, 631501</a>"
"<a class=""StoreCard_storeAddress__PfC_v null"" href="""" style=""margin-bottom:5px"">7/9, Pammal Main Road, Opposite Radiance Pride, Pallavaram, Muthamizh Nagar, Pammal, Chennai, Tamil Nadu, 600075</a>"
"<a class=""StoreCard_storeAddress__PfC_v null"" href="""" style=""margin-bottom:5px"">No 510, East Pondy Road, Near Sacred Heart Convent, Villupuram, Tamil Nadu, 605602</a>"
"<a class=""StoreCard_storeAddress__PfC_v null"" href="""" style=""margin-bottom:5px"">No 1045, Aerohub, MLCP Block, Chennai International Airport, GST Road, Meenambakkam, Chennai, Tamil Nadu, 600027</a>"
"<a class=""StoreCard_storeAddress__PfC_v null"" href="""" style=""margin-bottom:5px"">Municipal Door No 127/2, Mannarsamy Koil Street, Royapuram, Near Gk Jain School, Chennai, Tamil Nadu, 600013</a>"
"<a class=""StoreCard_storeAddress__PfC_v null"" href="""" style=""margin-bottom:5px"">197 Palani Road, Udumalpet, Udumalpet, Tiruppur, Tamil Nadu, 642126</a>"
"<a class=""StoreCard_storeAddress__PfC_v null"" href="""" style=""margin-bottom:5px"">Old No 605A, New No 490, Mth Road, Ambattur, Opposite Singapore Shopping, Chennai, Tamil Nadu, 600053</a>"
"<a class=""StoreCard_storeAddress__PfC_v null"" href="""" style=""margin-bottom:5px"">G/A, F/36, Kg Galaxy, 2Nd Avenue, , Annanagar East, Near Naidu Hall, Chennai, Tamil Nadu, 600102</a>"
"<a class=""StoreCard_storeAddress__PfC_v null"" href="""" style=""margin-bottom:5px"">295/1, Thirumala Avenue, Mettupalayam Road, Thoppampatti Pirivu, Rakkipalayam Post, Coimbatore, Tamil Nadu, 641017</a>"
"<a class=""StoreCard_storeAddress__PfC_v null"" href="""" style=""margin-bottom:5px"">Shop No 116, Gst Road, Chengalpattu, Next To Chellamani &amp; Co, Guduvanchery, Tamil Nadu, 603202</a>"
"<a class=""StoreCard_storeAddress__PfC_v null"" href="""" style=""margin-bottom:5px"">Plot No 1163, 57Th Street Tnbh, Korattur, Near Korattur Bus Stand, Chennai, Tamil Nadu, 600080</a>"
"<a class=""StoreCard_storeAddress__PfC_v null"" href="""" style=""margin-bottom:5px"">Door Old 34, New 98, Redhill Road, Kalpalayam, Vinayagapuram, Next To Axis Bank, Chennai, Tamil Nadu, 600099</a>"
"<a class=""StoreCard_storeAddress__PfC_v null"" href="""" style=""margin-bottom:5px"">167,169/133-134, Dharapuram Main Road, Opposite Usha Theater, Tiruppur, Tamil Nadu, 641604</a>"
"<a class=""StoreCard_storeAddress__PfC_v null"" href="""" style=""margin-bottom:5px"">Plot No 13 &amp; 14, Ramagiri Layout, Tharamani Link Road, Velachery, Near Indus Ind Bank, Chennai, Tamil Nadu, 600042</a>"
"<a class=""StoreCard_storeAddress__PfC_v null"" href="""" style=""margin-bottom:5px"">203 /3AP, Medical College Road, Mangalapuram, Near Punjab National Bank, Thanjavur, Tamil Nadu, 613007</a>"
"<a class=""StoreCard_storeAddress__PfC_v null"" href="""" style=""margin-bottom:5px"">Shop No 203, Second Floor, Nexus Vijaya Mall 183, Arcot Road, Vadapalani, Chennai, Tamil Nadu, 600026</a>"
"<a class=""StoreCard_storeAddress__PfC_v null"" href="""" style=""margin-bottom:5px"">No 349, East Coast Road, Neelankarai, Near K L Hospital, Chennai, Tamil Nadu, 600115</a>"
"<a class=""StoreCard_storeAddress__PfC_v null"" href="""" style=""margin-bottom:5px"">5/1&amp; 4/1, Theyagaraya Road, T Nagar, Pondy Bazar, Opposite Grand Grt Hotal, Chennai, Tamil Nadu, 600017</a>"
"<a class=""StoreCard_storeAddress__PfC_v null"" href="""" style=""margin-bottom:5px"">1st Floor, City Centre Mall, Dr Radhakrishnan Salai, Mylapore, Chennai, Tamil Nadu, 600004</a>"
"<a class=""StoreCard_storeAddress__PfC_v null"" href="""" style=""margin-bottom:5px"">266/460, Avinashi Road, Tiruppur, Tamil Nadu, 641602</a>"
"<a class=""StoreCard_storeAddress__PfC_v null"" href="""" style=""margin-bottom:5px"">Hig 31, Nh 1, Vallal Mgr Road, Maraimalai Nagar, Kanchipuram, Chengalpattu, Maraimalai Nagar, Next To Spencers Super Market, Chennai, Tamil Nadu, 603204</a>"
"<a class=""StoreCard_storeAddress__PfC_v null"" href="""" style=""margin-bottom:5px"">Shop No 67-71, Brookefields Mall, Krishna Swamy Road, Coimbatore, Tamil Nadu, 641001</a>"
"<a class=""StoreCard_storeAddress__PfC_v null"" href="""" style=""margin-bottom:5px"">Shop No 90, Ground Floor, Ganesha Towers, Dr Radha Krishnan Salai, Mylapore, Near Pnb, Chennai, Tamil Nadu, 600004</a>"
"<a class=""StoreCard_storeAddress__PfC_v null"" href="""" style=""margin-bottom:5px"">New No 78 &amp; Old No 53, Muttukadu Road, Thiruvanmiyur, Near Rto Office, Chennai, Tamil Nadu, 600041</a>"
"<a class=""StoreCard_storeAddress__PfC_v null"" href="""" style=""margin-bottom:5px"">Municipal No 17/A, Grs Complex, Tank Street, Near Gunam Super Speciality Hospital, Hosur, Tamil Nadu, 635109</a>"
"<a class=""StoreCard_storeAddress__PfC_v null"" href="""" style=""margin-bottom:5px"">3-6-110/1,2,3 Shop No 1, Ground Floor, Anand Arcade, Himayath Nagar, Opposite Tata Motors, Hyderabad, Telangana, 500029</a>"
"<a class=""StoreCard_storeAddress__PfC_v null"" href="""" style=""margin-bottom:5px"">H No 37 74/11/1, Plot No E-62, Survey No 218/1/3, Jj Nagar Ramakrishnapuram, Malkajgiri Municipality And Mandal Ranga Reddy, Neredmet, Hyderabad, Telangana, 500094</a>"
"<a class=""StoreCard_storeAddress__PfC_v null"" href="""" style=""margin-bottom:5px"">Plot No 6 S, Nos 60 6162/1, New Vasavi Colony, Second Venture Kakaguda, Village Secunderabad Cantonment Area, Vikrampuri, Hyderabad, Telangana, 500015</a>"
"<a class=""StoreCard_storeAddress__PfC_v null"" href="""" style=""margin-bottom:5px"">18-390-1, 2F, Viduth Colony, Pargi Road, Near Bike Bazar, Shadnagar, Telangana, 509216</a>"
"<a class=""StoreCard_storeAddress__PfC_v null"" href="""" style=""margin-bottom:5px"">House 5-3-98, Old Nh7 Road, Old Nh7 Road, Opposite Muncipal Office, Kamareddy, Telangana, 503111</a>"
"<a class=""StoreCard_storeAddress__PfC_v null"" href="""" style=""margin-bottom:5px"">FF 02 &amp; 03, First Floor, DSL Virtue Mall, Ramanthapur Main Road, Ida Uppal, Near Uppal Metro Station, Hyderabad, Telangana, 500039</a>"
"<a class=""StoreCard_storeAddress__PfC_v null"" href="""" style=""margin-bottom:5px"">Plot No 8/B, H No 14-81/13/8/B/A/1, Raghavendra Colony, Beeramguda, Ramachandrapuram, Hyderabad, Telangana, 502032</a>"
"<a class=""StoreCard_storeAddress__PfC_v null"" href="""" style=""margin-bottom:5px"">H No 5-5858/1(New), 5-5-511(Old), Plot No 27 &amp;30, Ward No 05, Chintalknta Of Sahebnagar, Kjurd Village, Hyathnagar Mandal, Ranga Reddy District,Vanasthalipuram, Hyderabad,Telangana, 500074</a>"
"<a class=""StoreCard_storeAddress__PfC_v null"" href="""" style=""margin-bottom:5px"">Property No 1/11/222/D/3, Sp Road, Begumpet, Opposite Hdfc Bank, Near Shopper Stop, Secunderabad, Telangana, 500016</a>"
"<a class=""StoreCard_storeAddress__PfC_v null"" href="""" style=""margin-bottom:5px"">Shop No 17/1/383/N/80/31, Block No 1, Brindavan Colony Nagar, Champapet, Opposite Manda Ram Reddy Garden, Hyderabad, Telangana, 500079</a>"
"<a class=""StoreCard_storeAddress__PfC_v null"" href="""" style=""margin-bottom:5px"">Shop No 5-77/26/31, Bhavani Nagar Old Alwal, Opposite Bhatah Petrol Bunk Ig Statue, Loyola College Road, Old Alwal, Secunderabad, Telangana, 500010</a>"
"<a class=""StoreCard_storeAddress__PfC_v null"" href="""" style=""margin-bottom:5px"">Plot No 124 In Survey No 64, Ward No 3, Block No 8, Door No 3-11-22, Sri Enclave, Suvidha Arcade, Rtc Colony, Lb Nagar, Bahadurguda, Hyderabad, Telangana, 500074</a>"
"<a class=""StoreCard_storeAddress__PfC_v null"" href="""" style=""margin-bottom:5px"">Plot No 24, H No 23-39/24, Ground Floor, Sharada Plaza, Bharath Petroleum Lane, Near Nagole X Road, Nagole Circle, Uppal Mandal, Medchal Malkajgiri, Hyderabad, Telangana, 500068</a>"
"<a class=""StoreCard_storeAddress__PfC_v null"" href="""" style=""margin-bottom:5px"">D#12-6-2/216, P#1 Sy#577, Ground Floor, Kukatpally, Opposite Bjp Office, Hyderabad, Telangana, 500072</a>"
"<a class=""StoreCard_storeAddress__PfC_v null"" href="""" style=""margin-bottom:5px"">Door No 4-1382, Raja Rajeswara Nagar, Kondapur Village, Serilingampally Mandal, Ranga Reddy, Kondapur, Telangana, 500084</a>"
"<a class=""StoreCard_storeAddress__PfC_v null"" href="""" style=""margin-bottom:5px"">Victory Plaza, Plot No 11 Extension, Ecil X Main Road, Khushaiguda, Khushaiguda, Opposite Sbi Bank, Hyderabad, Telangana, 500062</a>"
"<a class=""StoreCard_storeAddress__PfC_v null"" href="""" style=""margin-bottom:5px"">Shetter No 3, 11-26-226, Islamia Complex, M G Road, Opposite Mgm Hospital Gate No 1, Warangal, Telangana, 506007</a>"
"<a class=""StoreCard_storeAddress__PfC_v null"" href="""" style=""margin-bottom:5px"">Shop No 9A, Ground Floor, Sattva Necklace Mall, Municipal No 8 To 32/395, Survey No 33 To 39/85/1, Ward No 6 Block 6 Plot No 1, Kavadiguda, Secunderabad, Telangana, 500080</a>"
