Store Name,Address,Location,Timings,Latitude,Longitude,Phone"<a class=""StoreCard_storeAddress__PfC_v null"" href="""" style=""margin-bottom:5px"">9, L R Complex, 50 Feet Main Road, Avalahalli, Muneshwara Block, Banashankari, L R Complex, Bengaluru, Karnataka, 560026</a>"
"<a class=""StoreCard_storeAddress__PfC_v null"" href="""" style=""margin-bottom:5px"">Shop No F/68, 1St Floor, Whitefield Main Road, Mahadevpura, Phoenix Market City Mall, Bengaluru, Karnataka, 560048</a>"
"<a class=""StoreCard_storeAddress__PfC_v null"" href="""" style=""margin-bottom:5px"">Huliyappa Arcade 22, 2Nd Block, Nagarbhavi 2Nd Stage, Annapurneshwari Nagar, Bengaluru, Karnataka, 560072</a>"
"<a class=""StoreCard_storeAddress__PfC_v null"" href="""" style=""margin-bottom:5px"">Ug13, 3W3-268/25, Marian Paradise Streak, Bejai Road, Near Bejai Church, Mangaluru, Karnataka, 575004</a>"
"<a class=""StoreCard_storeAddress__PfC_v null"" href="""" style=""margin-bottom:5px"">197/1, AKG Colony, Channasandra Main Road, Bengaluru, Karnataka, 560067</a>"
"<a class=""StoreCard_storeAddress__PfC_v null"" href="""" style=""margin-bottom:5px"">24th Main Road, RK Colony, Manjunath, Colony, 2nd Phase, JP Nagar, Bengaluru, Karnataka, 560078</a>"
"<a class=""StoreCard_storeAddress__PfC_v null"" href="""" style=""margin-bottom:5px"">Shop No 2813 D-1A, Ground Floor, Ganesh Arcade, Kalidasa Road, Above Green Leaf Hotel, Mysuru, Karnataka, 570002</a>"
"<a class=""StoreCard_storeAddress__PfC_v null"" href="""" style=""margin-bottom:5px"">2003/1-1, Arihant Building, Second Stage, Indiranagar 100Ft Road, Arihant Building, Bengaluru, Karnataka, 560008</a>"
"<a class=""StoreCard_storeAddress__PfC_v null"" href="""" style=""margin-bottom:5px"">Shop No 25/6/26/27/61, Ground Floor, Yelenchenahalli, Kanakpura Road, Near Yelenchanahalli Metro Station, Bengaluru, Karnataka, 560078</a>"
"<a class=""StoreCard_storeAddress__PfC_v null"" href="""" style=""margin-bottom:5px"">Shop No1, Prestige Falcon City Mall, Kanakapura Road, Anjanadri Layout, Konanakunte Cross Metro, Konanakunte, Prestige Falcon City Mall, Bengaluru, Karnataka, 560062</a>"
"<a class=""StoreCard_storeAddress__PfC_v null"" href="""" style=""margin-bottom:5px"">Plot No. 7, E.W.S. Block No 10 to 22, Sri Ganesh Prasad Sabha Graha, HIG 57 2nd Cross Hubli Taluk, Navananagar, Hubli, Karnataka, 580025</a>"
"<a class=""StoreCard_storeAddress__PfC_v null"" href="""" style=""margin-bottom:5px"">203/205, Mint Plaza, Ground Floor, Green Glen Layout, New Bellandur, Next To Reliance Fresh, Bengaluru, Karnataka, 560103</a>"
"<a class=""StoreCard_storeAddress__PfC_v null"" href="""" style=""margin-bottom:5px"">Rajsan Complex, Ground Floor, No 1-16/2-5, Pumpwell Road, Kankanady, Kankanady, Near Omega Hospital, Mangaluru, Karnataka, 575002</a>"
"<a class=""StoreCard_storeAddress__PfC_v null"" href="""" style=""margin-bottom:5px"">Unit 222, Second Floor, Forum Neighbourhood Mall, Whitefield, Bengaluru, Karnataka, 560066</a>"
"<a class=""StoreCard_storeAddress__PfC_v null"" href="""" style=""margin-bottom:5px"">Cts No 5647/1, Ground Floor, New Goods Shed Road, Khanapur Road, Opposite Fire Fighter Station Belgaum, Belagavi, Karnataka, 590011</a>"
"<a class=""StoreCard_storeAddress__PfC_v null"" href="""" style=""margin-bottom:5px"">948, Vln Square, Lig 2Nd Satge, 16Th B Cross Road, 2Nd Stage, Yelahanka New Town, Yelahanka, Near Sri Raghavendra Nursing Home, Bengaluru, Karnataka, 560064</a>"
"<a class=""StoreCard_storeAddress__PfC_v null"" href="""" style=""margin-bottom:5px"">Ground Floor, Premium Enclave, Light House Hill Road, Hampankatta, Opposite To Canara Bank, Mangaluru, Karnataka, 575001</a>"
"<a class=""StoreCard_storeAddress__PfC_v null"" href="""" style=""margin-bottom:5px"">34, Sy No 39/1, Vidyasagar Bus Stop, Thanisandra Road Main, Dr Shivaram Karanth Nagar Post, Nagwara, Opposite Dhurudesh Honda Showroom, Bengaluru, Karnataka, 560077</a>"
"<a class=""StoreCard_storeAddress__PfC_v null"" href="""" style=""margin-bottom:5px"">New No 2954/4, Plot No K 12/4, Khata No 38/2004, Chamundipuram Circle, Next To More Market, Mysuru, Karnataka, 570008</a>"
"<a class=""StoreCard_storeAddress__PfC_v null"" href="""" style=""margin-bottom:5px"">Jr Plaza 6, Kanakapura Main Road, Metro Pillar No 217, Raghuvanahalli, Near Karnataka Bank, Bengaluru, Karnataka, 560062</a>"
"<a class=""StoreCard_storeAddress__PfC_v null"" href="""" style=""margin-bottom:5px"">Ground Floor Plot No 348/689, Nagarbhavi 80Ft Road, Vinayaka Layout, Nagarbhavi, Bengaluru, Karnataka, 560072</a>"
"<a class=""StoreCard_storeAddress__PfC_v null"" href="""" style=""margin-bottom:5px"">68/62, Labh Villa, Whitefield, Near Csi Memorial Church, Bengaluru, Karnataka, 560066</a>"
"<a class=""StoreCard_storeAddress__PfC_v null"" href="""" style=""margin-bottom:5px"">Shop No 11A, 1St Floor, Nexus Mall, Mangladevi Temple Road, Pandeshwar, Mangaluru, Karnataka, 575001</a>"
"<a class=""StoreCard_storeAddress__PfC_v null"" href="""" style=""margin-bottom:5px"">Ground Floor 199, Mg Road, Chikkolale, Opposite Sri Vasavi Kannikaparameshwari Temple, Chikkamagaluru, Karnataka, 577101</a>"
"<a class=""StoreCard_storeAddress__PfC_v null"" href="""" style=""margin-bottom:5px"">323, 3rd Stage, 4th block, Dr Sidhaiahpuranik Road, West chord Road, Basaweshwara Nagar, Bengaluru, Karnataka, 560079</a>"
"<a class=""StoreCard_storeAddress__PfC_v null"" href="""" style=""margin-bottom:5px"">Shop No 704, Ground Floor, Asn Signature, Varthur Road, Ramagondanahalli, Siddapura, Near Laughing Waters, Bengaluru, Karnataka, 560066</a>"
"<a class=""StoreCard_storeAddress__PfC_v null"" href="""" style=""margin-bottom:5px"">#1138, Ground Floor, 6Th Cross Road, Sri Anantha Nagar, Electronic City Phase 2, Near Ashirwadh Classic Apartment, Bengaluru, Karnataka, 560100</a>"
"<a class=""StoreCard_storeAddress__PfC_v null"" href="""" style=""margin-bottom:5px"">Hebbal 1St Stage, Jv Arcade, Hebbal, Near Surya Bakery Circle, Mysuru, Karnataka, 570016</a>"
"<a class=""StoreCard_storeAddress__PfC_v null"" href="""" style=""margin-bottom:5px"">Rajapalya, Itpl Main Road, Mahadevapura, Hoodi Circle, Bengaluru, Karnataka, 560048</a>"
"<a class=""StoreCard_storeAddress__PfC_v null"" href="""" style=""margin-bottom:5px"">N0 3082, Khata Kt695/17/18, Vishwamanava Double Road, 3Rd Stage, Dattagalli, Mahamane Circle, Mahamane Circle, Near Bombatt Bhojana Hotel, Mysuru, Karnataka, 570024</a>"
"<a class=""StoreCard_storeAddress__PfC_v null"" href="""" style=""margin-bottom:5px""># 2/537, 540, 541, Kozhikode Road, Kodathipadi, Mannarkkad PO, Mannarkkad, Kerala, 678583</a>"
"<a class=""StoreCard_storeAddress__PfC_v null"" href="""" style=""margin-bottom:5px"">Block No 210, High School Junction, Near Skycell, West Taluk, Kollam, Kerala, 691009</a>"
"<a class=""StoreCard_storeAddress__PfC_v null"" href="""" style=""margin-bottom:5px"">Tc 91,270, Lulu International Shopping Mall, Akkulam Bridge, Anayara Post, Akkulam Bridge, Opposite Kerala Hotel, Thiruvananthapuram, Kerala, 695029</a>"
"<a class=""StoreCard_storeAddress__PfC_v null"" href="""" style=""margin-bottom:5px"">Door No 6, Ground Floor, Athikavil Building, Palakkad Highway, Kondotty Malappuram, Kondotty, Opposite Bsnl Office, Malappuram, Kerala, 673638</a>"
"<a class=""StoreCard_storeAddress__PfC_v null"" href="""" style=""margin-bottom:5px"">Building No 17/219-2&amp; 17/219-3, Old No, 12/210-2 &amp; 12/210-3 , Ground Floor, Nelko Square, Pandavath Junction, Maradu, Near Ps Mission Hospital, Kochi, Kerala, 682304</a>"
"<a class=""StoreCard_storeAddress__PfC_v null"" href="""" style=""margin-bottom:5px"">Building No 37/442, Ishaan Enterprises, Kadavanthara Road, Kaloor, Ernakulam, Near Akshya Hospital, Kochi, Kerala, 682020</a>"
"<a class=""StoreCard_storeAddress__PfC_v null"" href="""" style=""margin-bottom:5px"">Union Bank Complex, Edodi Road, Vatakara, Near Union Bank, Kozhikode, Kerala, 673101</a>"
"<a class=""StoreCard_storeAddress__PfC_v null"" href="""" style=""margin-bottom:5px"">Shop No 19/1011 B, Hill Palace, Nediyathu N Square, Market Junction, Kizhakekotta, Thrippunithura, Kerala, 682301</a>"
"<a class=""StoreCard_storeAddress__PfC_v null"" href="""" style=""margin-bottom:5px"">Building No 23/596-10, Stadium Bypass Road Palakkad, Near Reliance Digital, Palakkad, Kerala, 678001</a>"
"<a class=""StoreCard_storeAddress__PfC_v null"" href="""" style=""margin-bottom:5px"">#10/1358,Near Chemmanur Jellewery, Cng Road, Edakkara, Near Chemmanur Jellewery, Malappuram, Kerala, 679331</a>"
"<a class=""StoreCard_storeAddress__PfC_v null"" href="""" style=""margin-bottom:5px"">Shop No 25/74, Kizhakkumthal Building, Bank Junction, Nh 47, Angamaly, Opposite South Indian Bank, Cochin, Kerala, 683572</a>"
"<a class=""StoreCard_storeAddress__PfC_v null"" href="""" style=""margin-bottom:5px"">Old No 14/199, New No 28/389 Vattom, Karakkode Vadakkum Kara Inam Panddarappattom, Hospital Road, Nedumangad, Thiruvanthapuram, Kerala, 695541</a>"
"<a class=""StoreCard_storeAddress__PfC_v null"" href="""" style=""margin-bottom:5px"">IMG Junction, Info Park Road, kakkanad, Near Professional Couriers, Cochin, Kerala, 682030</a>"
"<a class=""StoreCard_storeAddress__PfC_v null"" href="""" style=""margin-bottom:5px"">Ground Floor, Highway Arcade, Teekay Junction, Thana, Kannur, Kerala, 670012</a>"
"<a class=""StoreCard_storeAddress__PfC_v null"" href="""" style=""margin-bottom:5px"">Chungam Junction, Near Chemmannur Jewellers, Kalpetta , Kerala, 673122</a>"
"<a class=""StoreCard_storeAddress__PfC_v null"" href="""" style=""margin-bottom:5px"">Room No 20/413, Theruvil Building, Pala Muncipality, Lalam Village, Meenachalil Thaluk, Pala, Opposite Max, Kottayam, Kerala, 686575</a>"
"<a class=""StoreCard_storeAddress__PfC_v null"" href="""" style=""margin-bottom:5px"">Block No 177, Chinnakada, Kollam Andamamukkom, Main Road, Nedumangad, Beside Planet Fashion, Kollam, Kerala, 691001</a>"
"<a class=""StoreCard_storeAddress__PfC_v null"" href="""" style=""margin-bottom:5px"">Shop No 33/19 B14, Ammus Arcade, Padivattom, Ernakulam, Opposite Kerala State Beverages Corporation, Kochi, Kerala, 682024</a>"
"<a class=""StoreCard_storeAddress__PfC_v null"" href="""" style=""margin-bottom:5px"">Valayil Building, Kalathippady, Vadavathoor PO, Kottayam, Kerala, 686010</a>"
"<a class=""StoreCard_storeAddress__PfC_v null"" href="""" style=""margin-bottom:5px"">Door No 6/1543, Kochulloor P O, Uloor, Kochulloor, Near Indian Oil Pump, Thiruvananthapuram, Kerala, 695011</a>"
"<a class=""StoreCard_storeAddress__PfC_v null"" href="""" style=""margin-bottom:5px"">Building No 4/277B, Vetteel Estate, 26, Kanjikuzhy, Muttambalam, Vetteel Estate, Kottayam, Kerala, 686004</a>"
"<a class=""StoreCard_storeAddress__PfC_v null"" href="""" style=""margin-bottom:5px"">Ground Floor, Tc New No 14/3717, Old No 2/3496/4, Pattom, Pattom, Opposite Reliance Trends Pattom, Thiruvananthapuram, Kerala, 695004</a>"
"<a class=""StoreCard_storeAddress__PfC_v null"" href="""" style=""margin-bottom:5px"">Pallivathukkal Building, Vaikom Road, Opposite Canara Bank, Thalayolaparambu, Kottayam, Kerala, 686605</a>"
"<a class=""StoreCard_storeAddress__PfC_v null"" href="""" style=""margin-bottom:5px"">#24/1024 A, Maharaja Complex, Manikuni, Sulthan Bathery, Near Lulu Wedding, Wayanad, Kerala, 673592</a>"
"<a class=""StoreCard_storeAddress__PfC_v null"" href="""" style=""margin-bottom:5px"">First Floor, Padinjattethil Complex, Near Head Post Office, Idukki Kavala, Kattappana, Kerala, 685508</a>"
"<a class=""StoreCard_storeAddress__PfC_v null"" href="""" style=""margin-bottom:5px"">Ground Floor, Central Mall of Emad, Near New Private Bus Stand, Thavakkara, Kannur, Kerala, 670001</a>"
"<a class=""StoreCard_storeAddress__PfC_v null"" href="""" style=""margin-bottom:5px"">Ground Floor, Block No 10, Village And Mandal Tadeppalli Panchayath Area Farkka, Kundara Taluk, Kollam, Kerala, 691501</a>"
"<a class=""StoreCard_storeAddress__PfC_v null"" href="""" style=""margin-bottom:5px"">Ground Floor, Block 22, SY No 279/5, Kizhakkekara, Kottarakara, Kollam, Kerala, 691531</a>"
"<a class=""StoreCard_storeAddress__PfC_v null"" href="""" style=""margin-bottom:5px"">Kockaparambil Buildings, Kollam, Theni Highway, Chengannur, Kerala, 689121</a>"
"<a class=""StoreCard_storeAddress__PfC_v null"" href="""" style=""margin-bottom:5px"">Ground Floor, Kanampuram Square, Mc Road, Near Signal Junction, Perumbavoor, Cochin, Kerala, 683542</a>"
"<a class=""StoreCard_storeAddress__PfC_v null"" href="""" style=""margin-bottom:5px"">Tp Building , G Hospital Road, Palayam, Calicut, Kerala, 673001</a>"
"<a class=""StoreCard_storeAddress__PfC_v null"" href="""" style=""margin-bottom:5px"">8/315,Vyapara Bhavan Building, Chendamangalam junction, North Paravur, Ernakulam, Kerala, 683513</a>"
"<a class=""StoreCard_storeAddress__PfC_v null"" href="""" style=""margin-bottom:5px"">A One arcade, Taluk Municipality, Tirur Desam, K G Padi Road, Trikkandiyoor, Tirur, Kerala, 676101</a>"
"<a class=""StoreCard_storeAddress__PfC_v null"" href="""" style=""margin-bottom:5px"">6/685, 6/686, 6/687, Ground Floor, Jr Complex, Talap, Mangalore Highway, Talap, Opposite Koyili Hospital, Kannur, Kerala, 670004</a>"
"<a class=""StoreCard_storeAddress__PfC_v null"" href="""" style=""margin-bottom:5px"">Door No 70/1928, H1 Ground Floor, Ace Avenue, Karaparamba, Near Icici Bank, Calicut, Kerala, 673010</a>"
"<a class=""StoreCard_storeAddress__PfC_v null"" href="""" style=""margin-bottom:5px"">Madukkakakuzhy Arcade, Kanjirappally, Kerala, 686555</a>"
"<a class=""StoreCard_storeAddress__PfC_v null"" href="""" style=""margin-bottom:5px"">Ruby'S Arc, T B Junction, T B Junction, Near Children'S Park, Attingal, Kerala, 695101</a>"
"<a class=""StoreCard_storeAddress__PfC_v null"" href="""" style=""margin-bottom:5px"">325 &amp; 2, Kottappadikkal Nettugada, Parambu City Square, Down Hill, Malappuram, Kerala, 676519</a>"
"<a class=""StoreCard_storeAddress__PfC_v null"" href="""" style=""margin-bottom:5px"">E 87, Sh 16, Bypass Junction, Aluva, Opposite To Aluva Metro Station, Kochi, Kerala, 683101</a>"
"<a class=""StoreCard_storeAddress__PfC_v null"" href="""" style=""margin-bottom:5px"">Taluk Koilandi, Amsam Menjanyam, Sub District Perambra, Kozhikode, Kerala, 673525</a>"
"<a class=""StoreCard_storeAddress__PfC_v null"" href="""" style=""margin-bottom:5px"">Ground Floor, IAS Building, Opposite NK Silks, NH 66, Kottiyam, Kollam, Kerala, 691471</a>"
"<a class=""StoreCard_storeAddress__PfC_v null"" href="""" style=""margin-bottom:5px"">P John Zhachariah Building, Near Thirunakkara Maiadan, Thirunakkara S Road, Kottayam, Kerala, 686001</a>"
"<a class=""StoreCard_storeAddress__PfC_v null"" href="""" style=""margin-bottom:5px"">62-L Vilangalil Building, Mini Road Junction, Changuvetty Kottakkal Malappuram, Kottakkal, Kerala, 676503</a>"
"<a class=""StoreCard_storeAddress__PfC_v null"" href="""" style=""margin-bottom:5px"">#40, 9660, Ground Floor, Mg Road, Near Mg Road Metro Station, Cochin, Kerala, 682001</a>"
"<a class=""StoreCard_storeAddress__PfC_v null"" href="""" style=""margin-bottom:5px"">Nc'S Business Bay, Kacheripadi, , Manjeri, Opposite Igbt Bus Stand, Manjeri, Kerala, 676121</a>"
"<a class=""StoreCard_storeAddress__PfC_v null"" href="""" style=""margin-bottom:5px"">Mavoor Road, Arayidathupalam, Mavoor, Opposite New Bus Stand, Kozhikode, Kerala, 673004</a>"
"<a class=""StoreCard_storeAddress__PfC_v null"" href="""" style=""margin-bottom:5px"">Ward 10th, Ettumanoor Municipality, Village Peroor Kara, V Arcade, Thellakom, Kottayam, Kerala, 686630</a>"
"<a class=""StoreCard_storeAddress__PfC_v null"" href="""" style=""margin-bottom:5px"">SY No 69-7/5 Of Vattakavu Padivattom, Southern Side Of Kudiyirippu Parambu, Next To Koppans Mall, Ponnani Road Village, Pattambi, Thrissur, Kerala, 67</a>"
"<a class=""StoreCard_storeAddress__PfC_v null"" href="""" style=""margin-bottom:5px"">Door No 34/1955, Mini Bye Pass Road, Calicut, Near Mankavu Jn Mankavu, Calicut, Kerala, 673007</a>"
"<a class=""StoreCard_storeAddress__PfC_v null"" href="""" style=""margin-bottom:5px"">City Tower, Kallachi, Villyappaly Road, Opposite HP Petrol Pump, Nadapuram, Calicut, Kerala, 673504</a>"
"<a class=""StoreCard_storeAddress__PfC_v null"" href="""" style=""margin-bottom:5px"">New Amprayil Building, T K Road, YMCA Junction, Thiruvalla, Kottayam, Kerala, 689101</a>"
"<a class=""StoreCard_storeAddress__PfC_v null"" href="""" style=""margin-bottom:5px"">The Tillery Square, St George School Junction, Aluva Munnar Road, Bhakashya Suraksha Market, Center Of Bhakashya Suraksha Market, Kothamangalam, Kerala, 686691</a>"
"<a class=""StoreCard_storeAddress__PfC_v null"" href="""" style=""margin-bottom:5px"">Ground Floor, 12/75, Trichur Road, Near Chicking, Malappuram, Edappal, Kerala, 679576</a>"
"<a class=""StoreCard_storeAddress__PfC_v null"" href="""" style=""margin-bottom:5px"">Parakkal Building, Shasthri Road, Kottayam, Kerala, 686001</a>"
"<a class=""StoreCard_storeAddress__PfC_v null"" href="""" style=""margin-bottom:5px"">68/1586, Ground Floor, Shaaz Building, West Hill Calicut, Near Bajaj Show Room, Calicut, Kerala, 673005</a>"
"<a class=""StoreCard_storeAddress__PfC_v null"" href="""" style=""margin-bottom:5px"">Near Duabi Future Store, Venjaramoodu, Thiruvananthapuram, Kerala, 695607</a>"
"<a class=""StoreCard_storeAddress__PfC_v null"" href="""" style=""margin-bottom:5px"">17/2330, Sea Port Airport Road, Chittethukara, Kakkanad, Near Bajaj Show Room, Cochin, Kerala, 682037</a>"
"<a class=""StoreCard_storeAddress__PfC_v null"" href="""" style=""margin-bottom:5px"">Kochumattathil Shopping Mall, Taluk Hospital Jn, Piravom, Near Reliance Trends, Cochin, Kerala, 686664</a>"
"<a class=""StoreCard_storeAddress__PfC_v null"" href="""" style=""margin-bottom:5px"">Ward No18, Kejees Building, Aroor, Thoppumpady Road, Thoppumpady Junction, Opposite St.Sebastian High School, Kochi, Kerala, 682005</a>"
"<a class=""StoreCard_storeAddress__PfC_v null"" href="""" style=""margin-bottom:5px"">15/1153,1154,1155,1156, Mozhiyl Puthen Veedu, Lalaji Junction, Opposite H&amp;J Mall, Karunagappalli, Kerala, 690518</a>"
"<a class=""StoreCard_storeAddress__PfC_v null"" href="""" style=""margin-bottom:5px"">KMC3561, K P Road, Chirakkadavam Muri, Kayamkulam, Alappuzha, Kerala, 690502</a>"
"<a class=""StoreCard_storeAddress__PfC_v null"" href="""" style=""margin-bottom:5px"">8#34,Ground Floor, Junction Po, Karamana, Near Karamana Bus Stop, Thiruvananthapuram, Kerala, 695002</a>"
"<a class=""StoreCard_storeAddress__PfC_v null"" href="""" style=""margin-bottom:5px"">Ground Floor, Meenu Mart Building, Ottupara, Wadakkancherry, Opposite Relief Medical, Thrissur, Kerala, 680582</a>"
"<a class=""StoreCard_storeAddress__PfC_v null"" href="""" style=""margin-bottom:5px"">34/1000, Shop No 45 &amp; 46, Second Floor, Nh 47, Edapally, Lulu International Shopping Mall, Kochi, Kerala, 682024</a>"
"<a class=""StoreCard_storeAddress__PfC_v null"" href="""" style=""margin-bottom:5px"">VPIII/217, Kohzikode Road Valanchery, Malappurram, Kerala, 676552</a>"
"<a class=""StoreCard_storeAddress__PfC_v null"" href="""" style=""margin-bottom:5px"">Devas Building, Door No 20/180/B2 &amp; B3, Karanthur Po Kunnamangalam, Kunnamangalam, Near Markaz College Main Gate, Calicut, Kerala, 673571</a>"
"<a class=""StoreCard_storeAddress__PfC_v null"" href="""" style=""margin-bottom:5px"">Door # 278H/278I, Maria Majestic, Ccmk Junction, Chalakudy, Opposite Esaf Bank, Thrissur, Kerala, 680307</a>"
"<a class=""StoreCard_storeAddress__PfC_v null"" href="""" style=""margin-bottom:5px"">Ground Floor, No 5/641 Kozhikode, Mysore Kollakkal, High Way Thamarassery, Thamarassey, Calicut, Kerala, 673573</a>"
"<a class=""StoreCard_storeAddress__PfC_v null"" href="""" style=""margin-bottom:5px"">Ground Floor, TC 82/2231, General Hospital Branch TVM, Deepa Arcade, Convent Road, Palayam, Opposite More Megastore, Thiruvananthapuram, Kerala, 695001</a>"
"<a class=""StoreCard_storeAddress__PfC_v null"" href="""" style=""margin-bottom:5px"">Vellanikaran Building, Irinjalakuda Main Road, Irinjalakuda, Opposite Govt Model Boys Higher Secondary School, Thrissur, Kerala, 680121</a>"
"<a class=""StoreCard_storeAddress__PfC_v null"" href="""" style=""margin-bottom:5px"">Ground Floor, Vijaya Towers, Keerankulangara, Palakkad Road, Near St Thomas College, Thrissur, Kerala, 680001</a>"
"<a class=""StoreCard_storeAddress__PfC_v null"" href="""" style=""margin-bottom:5px"">Block No13, Ward No 19, Inam Pandarapattam Desom Thalayal Fikra, Taluk Neyyatinkara, Balarampuram, Opposite Qrs, Thiruvananthapuram, Kerala, 695501</a>"
"<a class=""StoreCard_storeAddress__PfC_v null"" href="""" style=""margin-bottom:5px"">City Centre, North X-Ray Junction, Ac Road, Cherthala, Kerala, 688524</a>"
"<a class=""StoreCard_storeAddress__PfC_v null"" href="""" style=""margin-bottom:5px"">26/1414-1, Sn Arcade, Kulapulli Main Road, Ottapalam, Kerala, 679101</a>"
"<a class=""StoreCard_storeAddress__PfC_v null"" href="""" style=""margin-bottom:5px"">Kannattu Shopping Complex, Kallarkutty Road, Adimali, Idukki, Kerala, 685561</a>"
"<a class=""StoreCard_storeAddress__PfC_v null"" href="""" style=""margin-bottom:5px"">Shop No B1, Ground Floor, Oberon Mall, Nh Bypass Road, Edapally Ernakulam, Edapally, Oberon Mall, Ernakulam, Kerala, 682024</a>"
"<a class=""StoreCard_storeAddress__PfC_v null"" href="""" style=""margin-bottom:5px"">Myspex, Ekm Centre, Hospital Road, Perinthalmanna, Opposite Fire Station, Malappuram, Kerala, 679322</a>"
"<a class=""StoreCard_storeAddress__PfC_v null"" href="""" style=""margin-bottom:5px"">Shop No 2, Ground Floor, NH Bypass Service Road, Eanchakkal, Mall Of Travancore, Thiruvananthapuram, Kerala, 695024</a>"
"<a class=""StoreCard_storeAddress__PfC_v null"" href="""" style=""margin-bottom:5px"">P M 4/5 15-5, Aydish Tower, Bypass Road, Malappuram, Perinthalmanna, Near Bismi Hypermarket, Perinthalmanna, Kerala, 679322</a>"
"<a class=""StoreCard_storeAddress__PfC_v null"" href="""" style=""margin-bottom:5px"">Shop No 7/580, College Road, Opposite Pmg School, Palakkad, Kerala, 678001</a>"
"<a class=""StoreCard_storeAddress__PfC_v null"" href="""" style=""margin-bottom:5px"">Springs Tc No 44/913, Ground Floor, Vazhuthacaud, Po Thycaud, Vazhuthacaud, Near Reliance Fresh, Thiruvananthapuram, Kerala, 695014</a>"
"<a class=""StoreCard_storeAddress__PfC_v null"" href="""" style=""margin-bottom:5px"">Perumba SM Shopping Complex, Near KSRTC Stand, PO Payyanur, Kannur, Kerala, 670307</a>"
"<a class=""StoreCard_storeAddress__PfC_v null"" href="""" style=""margin-bottom:5px"">Amaal Tower, Room No Km 40/415 B 10 Nh, Koyilandy, Kozhikode, Kerala, 673305</a>"
"<a class=""StoreCard_storeAddress__PfC_v null"" href="""" style=""margin-bottom:5px"">Seaport Airport Road, Judgemukku, Thrikkakara, Near Bharathmatha College, Kochi, Kerala, 682021</a>"
"<a class=""StoreCard_storeAddress__PfC_v null"" href="""" style=""margin-bottom:5px"">Block No 15 &amp; Thandaper No 8270, Deepam Complex, Randamkutty, Kollam, Kerala, 691019</a>"
"<a class=""StoreCard_storeAddress__PfC_v null"" href="""" style=""margin-bottom:5px"">Akm Complex, Sankarayya Road, Railway Station Road, Kuttipuzha Nagar, Poothole, Thrissur, Kerala, 680004</a>"
"<a class=""StoreCard_storeAddress__PfC_v null"" href="""" style=""margin-bottom:5px"">Padippurayil Building Room No 29/404, 29/405, Opposite Punjab National Bank, Pathanamthitta, Kerala, 689645</a>"
"<a class=""StoreCard_storeAddress__PfC_v null"" href="""" style=""margin-bottom:5px"">Perunna, Changanassery, Kottayam, Kerala, 686101</a>"
"<a class=""StoreCard_storeAddress__PfC_v null"" href="""" style=""margin-bottom:5px"">Tc No 79/1322, Kowdiar Pattom Road, Kuravankonam, Near Supreme Bakery, Thiruvananthapuram, Kerala, 695004</a>"
"<a class=""StoreCard_storeAddress__PfC_v null"" href="""" style=""margin-bottom:5px"">Tc 13/1670, Murinjapalam, Kumarapuram Road, Murinjapalam, Opposite Gg Hospital, Thiruvananthapuram, Kerala, 695011</a>"
"<a class=""StoreCard_storeAddress__PfC_v null"" href="""" style=""margin-bottom:5px"">Door No 61 1800, Mg Road, Ravipuram, Atlantis Junction, Thevara, Ravipuram, Opposite Cochin Shipyard, Cochin, Kerala, 682015</a>"
"<a class=""StoreCard_storeAddress__PfC_v null"" href="""" style=""margin-bottom:5px"">39/594-2, Ground Floor, Kunjancheril Building, M.C Road, Ramanchira, Opposite To Sbi Sme Branch, Ramanchira, Thiruvalla, Kerala, 689107</a>"
"<a class=""StoreCard_storeAddress__PfC_v null"" href="""" style=""margin-bottom:5px"">Magna Business Centre, Sn Jn, Eroor Road, Thrippunithura, Opposite Lakshmi Ayurveda Hospital, Cochin, Kerala, 682301</a>"
"<a class=""StoreCard_storeAddress__PfC_v null"" href="""" style=""margin-bottom:5px"">Malabar Kiotchen Gallery, Eravipuram, Pallimuku Road, Vadakkevila, Near Malabar Kitchen Gallery, Kollam, Kerala, 691021</a>"
"<a class=""StoreCard_storeAddress__PfC_v null"" href="""" style=""margin-bottom:5px"">Shop No 62/931, Ground Floor, Citadel Arcade, Red Cross Road, Opposite Tagore Centenary Hall, Kozhikode, Kerala, 673032</a>"
"<a class=""StoreCard_storeAddress__PfC_v null"" href="""" style=""margin-bottom:5px"">Unit No 1F 103, 1st Floor, Forum Mall, NH 47, Vytilla Aroor Bypass, Near Kundannur Junction, Maradu, Kochi, Kerala, 682304</a>"
"<a class=""StoreCard_storeAddress__PfC_v null"" href="""" style=""margin-bottom:5px"">Block No 26, Muri/Kara Manukulathichamangalam, Karakkamandapam, Nemom, Thiruvananthapuram, Kerala, 695019</a>"
"<a class=""StoreCard_storeAddress__PfC_v null"" href="""" style=""margin-bottom:5px"">Essay Tower, Kovoor, Kozhikode, Kovoor, Near Medical College, Calicut, Kerala, 673008</a>"
